{
  "$schema": "https://json-schema.org/draft/2020-12/schema",
  "$id": "se/hub-findings.v1",
  "title": "System Explorer estate findings roll-up",
  "description": "Every finding the site's agents derive, folded into the hub's lifecycle registry (SPEC section 6.3). `current` is a statement only where the estate could look: a finding from an unswept agent or an unobserved collection carries observable=false and NO current member, because nobody can currently say — absence of the claim, never a fabricated value. Acknowledged findings stay in this list, marked: suppression is the one power the design refuses to create. Shared $defs are duplicated from findings.schema.json deliberately so each schema file is standalone.",
  "type": "object",
  "required": ["schema", "site", "observed_at", "writes_enabled", "hosts", "findings"],
  "properties": {
    "schema": { "const": "se.hub-findings/1" },
    "site": { "type": ["string", "null"] },
    "observed_at": { "$ref": "#/$defs/utcTimestamp" },
    "swept_at": {
      "$ref": "#/$defs/utcTimestamp",
      "description": "When the sweep behind this answer completed. The read serves the latest completed sweep instantly (the hub sweeps on its own cadence); this stamp is the staleness, stated rather than hidden."
    },
    "writes_enabled": {
      "type": "boolean",
      "description": "Whether this deployment granted the transition route (findingsWrites). Surfaced so a consumer can offer acknowledgement only where it exists."
    },
    "errors": {
      "type": "array",
      "items": { "type": "string", "minLength": 1 }
    },
    "hosts": {
      "type": "object",
      "additionalProperties": { "$ref": "#/$defs/hostSweep" }
    },
    "findings": {
      "type": "array",
      "items": { "$ref": "#/$defs/hubFinding" }
    }
  },
  "$defs": {
    "host": {
      "type": "object",
      "required": ["machine_id", "hostname"],
      "properties": {
        "machine_id": { "type": "string", "pattern": "^[0-9a-f]{32}$" },
        "hostname": { "type": "string", "minLength": 1 },
        "container": { "type": "string", "minLength": 1 },
        "app": { "type": "string", "minLength": 1 }
      }
    },
    "subsystemName": {
      "type": "string",
      "pattern": "^[a-z][a-z0-9-]*$"
    },
    "objectId": {
      "type": "string",
      "pattern": "^[a-z][a-z0-9-]*:\\S+$"
    },
    "hostSweep": {
      "type": "object",
      "required": ["swept"],
      "properties": {
        "swept": {
          "type": "boolean",
          "description": "Whether this agent's /v1/findings answered. False covers a dark host and an agent predating the surface alike — the error text distinguishes them, and either way its registry findings freeze rather than resolve."
        },
        "host": { "$ref": "#/$defs/host" },
        "status": { "enum": ["ok", "partial"] },
        "unobserved": {
          "type": "array",
          "items": {
            "type": "object",
            "required": ["subsystem", "collection", "reason"],
            "properties": {
              "subsystem": { "$ref": "#/$defs/subsystemName" },
              "collection": { "$ref": "#/$defs/subsystemName" },
              "reason": { "type": "string", "minLength": 1 }
            }
          }
        },
        "errors": {
          "type": "array",
          "items": { "type": "string", "minLength": 1 }
        },
        "error": { "type": "string", "minLength": 1 }
      }
    },
    "hubFinding": {
      "type": "object",
      "required": ["agent", "host", "subsystem", "collection", "object", "opinion", "evidence_ref", "observable"],
      "properties": {
        "agent": { "type": "string", "minLength": 1 },
        "host": { "$ref": "#/$defs/host" },
        "subsystem": { "$ref": "#/$defs/subsystemName" },
        "collection": { "$ref": "#/$defs/subsystemName" },
        "object": {
          "type": "object",
          "required": ["id", "type", "native_id"],
          "properties": {
            "id": { "$ref": "#/$defs/objectId" },
            "type": { "type": "string", "minLength": 1 },
            "native_id": { "type": "string", "minLength": 1 },
            "name": { "type": "string" }
          }
        },
        "opinion": {
          "type": "object",
          "required": ["key", "level", "message", "evidence"],
          "properties": {
            "key": { "type": "string", "pattern": "^[a-z][a-z0-9-]*$" },
            "level": { "enum": ["warn", "critical"] },
            "message": { "type": "string", "minLength": 1 },
            "evidence": {
              "type": "array",
              "minItems": 1,
              "items": { "type": "string", "minLength": 1 }
            }
          }
        },
        "evidence_ref": {
          "type": "string",
          "pattern": "^/v1/evidence/",
          "description": "Agent-relative; a hub consumer reaches it through /agents/{agent}."
        },
        "observable": {
          "type": "boolean",
          "description": "Whether the estate could currently look where this finding lives. False freezes the lifecycle and withholds `current`."
        },
        "current": {
          "type": "boolean",
          "description": "Derived this sweep (true) or observed absent by an agent that could look (false). Never present when observable is false."
        },
        "first_seen": { "$ref": "#/$defs/utcTimestamp" },
        "last_seen": { "$ref": "#/$defs/utcTimestamp" },
        "acknowledged": {
          "type": "boolean",
          "description": "The latest appended transition is an acknowledgement. Styling hint only: an acknowledged finding is never removed from this list or any projection."
        },
        "transitions": {
          "type": "array",
          "minItems": 1,
          "items": {
            "type": "object",
            "required": ["transition", "by", "at"],
            "properties": {
              "transition": { "enum": ["acknowledged", "unacknowledged"] },
              "by": { "type": "string", "minLength": 1 },
              "note": { "type": "string" },
              "at": { "$ref": "#/$defs/utcTimestamp" }
            }
          }
        }
      }
    },
    "utcTimestamp": {
      "type": "string",
      "pattern": "^\\d{4}-\\d{2}-\\d{2}T\\d{2}:\\d{2}:\\d{2}(\\.\\d+)?Z$"
    }
  }
}
